{
  "type": "framework-composition",
  "gaamVersion": "0.9.0",
  "status": "experimental",
  "normativeStatus": "non-normative",
  "frameworkId": "framework:ecosystem:main",
  "relationships": [
    {
      "targetFramework": "framework:service:issuer",
      "relationship": "specialises",
      "precedence": 10,
      "inheritedRequirements": [
        "GAAM-AUTH-001"
      ]
    }
  ]
}
